Title,Content
meitei-diaspora-worldwide-appeals-to-pm-modi-to-restore-normalcy-in-manipur,"Meitei diaspora worldwide appeals to PM Modi to restore normalcy in ManipurThe Meitei Diaspora worldwide and their supporters have written an Open Letter to the Hon’ble PM of India, Shri Narendra Modi, appealing to him for immediate action to restore normalcy in Manipur. Around 1300 well-wishers signed the open letter within 48 hours.The petition to the Prime Minister initiated by Meiteis NRIs and Meiteis of Indian origin implored the Prime Minister to pave the way for a harmonious Manipur. The Open Letter signed by concerned Meitei Diaspora worldwide and their supporters was submitted to the PMO on Monday, 4th September 2023.FULL TEXT BELOW:To,Shri Narendra Modi,Prime Minister of India,152, South Block, Raisina Hill,New Delhi – 1100113 September 2023Subject: Urgent Plea for Immediate Intervention to Restore Normalcy and Harmony in ManipurRespected Prime Minister Sir,On this solemn 3rd September, 2023, Manipur stands at the threshold of the fifth month, engulfed in turmoil. We, the Meitei Diaspora and our supporters, write to you today with a heavy heart and seek your intervention to end the violence and bring normalcy in Manipur, protect our farmers, and foster enduring peace amongst all the communities in Manipur.As India makes significant strides in development and prepares to host the G20 summit, the persistence of violence in Manipur threatens to undermine these achievements. The ongoing violence in Manipur has fractured the social fabric of the state. As custodians of the aspirations for a united and harmonious Manipur and India, we earnestly implore you to take resolute measures to prevent further escalation of the situation. The people of Manipur deserve lives free from fear, where they can thrive in an atmosphere marked by peace, stability and safety.The turmoil has placed our farmers, the backbone of our society, in grave jeopardy. The tragic incidents of farmers being attacked highlights their predicaments. For instance, on 29 August 2023, Salam Jotin, a 37-year-old farmer was shot by a long-range sniper gun while working at his field at Naranseina, Bishnupur District. The situation has been exacerbated by the displacement of many farmers currently forced to live in relief camps. Manipur is on the verge of a conflict-induced famine and starvation as farmers are not able to work in their fields despite the presence of security forces for their protection.More Stories like thisYUMNAM PATLOU DA MANIPUR LEINGAK KI WAREP HANDOK U HAIDUNA…Dec 13, 2022YUMPHAM YAODABA PROPAGANDA TOUDUNA NAMPHUDA YOO LEGALISATION…Sep 15, 2022YOONGOU LITRE 250 ROM PHAGATTUNA MANGHANKHRESep 4, 2022The ongoing violence has jeopardised the future of thousands of students, forcing them to discontinue their education. These harsh circumstances not only interrupt their current schooling but also cast an immense threat over their future opportunities. Education serves as the foundation for personal advancement and development. When violence forcibly removes this opportunity, it deprives the students of their potential and the possibility of realising their aspirations. This repercussion reverberates beyond individual lives, impeding the progress and prosperity of our society. Putting an end to senseless violence becomes paramount in preserving the dreams and ambitions of our youth.Appeal for Immediate Intervention to Restore Normalcy in ManipurSir, we acknowledge the intricate complexities inherent to our Manipur society – the Meiteis, the Nagas, and the Kuki communities, each with their own unique identities and aspirations. However, the pivotal role of your esteemed office is to serve as a binding force that ensures the protection and progress of every Indian citizen. By initiating meaningful dialogues among these communities, you hold the key to nurturing understanding and collaboration, paving the way for peacefulcoexistence.We implore you to engage personally with the Chief Minister of Manipur and the relevant authorities to restore the normalcy in our Manipur. The innocent people of Manipur have borne the burden of suffering beyond imagination and it is our collective responsibility to ensure their safety and well-being.Sir, as the Leader of our Great Nation, you have the power to shape the destiny of our Manipur and to illuminate the path of effective governance, empathy and bring in the much needed unity of the people of Manipur. We humbly request you to visit Manipur and meet the affected people by this senseless violence and ongoing turmoil. Your presence in Manipur and immediate intervention will bring hope and a sense of security to the violence ridden people and assure their life and livelihood.We hope your Leadership will pave the way to a peaceful and prosperous Manipur.Sincerely,Meitei Diaspora and Supporters.Copy to:● Shri Amit Shah, Hon’ble Minister of Home Affairs of India● Shri Rajnath Singh, Hon’ble Minister of Defence of India● Shri Dr. S Jaishankar, Hon’ble Minister of External Affairs of India● Shri N. Biren Singh, Hon’ble Chief Minister of ManipurAppeal for Immediate Intervention to Restore Normalcy in Manipur"
samkhok-film-on-unique-indigenous-way-of-tangkhul-life-released,"Samkhok celebrates the richness of the culture and tradition of the Tangkhul Nagas before the onset of Christianity. With every minute detail well-documented, Samkhok is an aide-mémoire of a unique indigenous way of life with a touch of the fragile human emotions of love and loss.TFM Ukhrul CorrespondentFormer MLA of 44-Ukhrul Assembly Constituency, Alfred Kanngam Arthur on Saturday released the much awaited Tangkhul film “Samkhok” in a jam pack audience at Town Hall, Ukhrul.Amidst the Manipur unrest that has gripped the state since 3 May 2023, the populace of Ukhrul Headquarters today got the opportunity to relief themselves from all the happenings, step out from their home and watch the much awaited Tangkhul feature film. Young and old from different walks of life can be seen queuing for ticket to watch the movie.About the movie:Inspired by true events, Samkhok celebrates the richness of the culture and tradition of the Tangkhul Nagas before the onset of Christianity.More Stories like thisUNLF condoles demise of Pvt MongoljaoFeb 5, 2024ASUK pays ‘revolutionary tribute’ to DhanaFeb 1, 2024ASUK announces ‘total shutdown’ on Republic DayJan 23, 2024With every minute detail well-documented, Samkhok is an aide-mémoire of a unique indigenous way of life with a touch of the fragile human emotions of love and loss.Aesthetically set in the backdrop of Ringui Village, Samkhok is woven around the family of a clan chief preparing the Feast of Merit (Maran Kasa), and the quest of the chief to avenge his son’s death. Through them, the movie intricately explores the bonding of a family, the complexity of land ownership, the custom and rituals of the community and the distinct bond with nature.Directed by AC Rinshing under the banner of Miwurlung Production in collaboration with NEFEC, cinematography by Sorenzan Vashum and written by Kahorrei AC, the movie will be also premiere at Delhi in the month of October. Pack with actions, the official trailer of the movie uploaded in YouTube has recieved much views and appreciations from the fans. Some commented that it is the Apolcalypto of Tangkhul.Fame fashion illustrator and designer, Easternlight Zimik wrote “we are no doubt among the most creative communities. All we need is support system and channel to sustain all this artistic value.  I have no words to describe how talented all these people are, with the means that we had and resources that we had and the support system that we know… taking all the risk and doing this vision. All the best to the Samkhok team.”A debut venture for the director and cinematography. The film promised to take viewers to a different level."
covid-cases-on-rise-in-manipur-as-safety-protocols-go-for-a-toss,"A girl student of Central Agricultural University, Imphal tested covid positive on 14 July. The dean orders all faculty members, scientists, UG 1yr students and all PG, Ph.D students to attend a Motivational Talk by the former Vice Chancellor, SVPUA&T, Meerut (UP) at CAU Auditorium without failTFM ReportPeople in Manipur seemed to be least bothered about the new wave of Covid though the number of coronavirus positive cases saw a steady rise since June-end. All the market places remained crowded and nobody adhered to covid protocol and safety guidelines.The state government, which was very proactive in instilling covid appropriate behaviours into people, also seemed to have lackadaisical approach to adopting covid control measures, like declaring specific geographic areas as containment or buffer zone to prevent local transmission and contact tracing to break chains of transmission, this time.For instance, a girl student of Central Agricultural University, Imphal tested covid positive on 14 July. Following the report, the dean of the university issued notice on 15 July requesting the students, teaching and non-teaching staff to strictly follow COVID-19 protocols issued by the Government of Manipur and urging them to avoid unnecessary movement outside the college, games and mass gathering.As per the notice, all exams will be conducted as per scheduled by following COVID-19 protocols. All theory classes are to be conducted through On-Line Mode with effect from 15th July 2022 (afternoon). Practical classes are to be conducted in off-line mode by following COVID-19 protocols.In case, anyone experiences COVID-19 symptoms, they must contact the medical team of the college and follow their advice and medication, added the notice.However, no process for contact tracing has been initiated to interrupt chains of transmission. No arrangement for prompt cleaning and disinfection of campus has been made to prevent the spread of the virus.To the surprise of all, dean of the university Prof. Indira Sarangthem issued an order directing to all faculty members, scientists, UG 1yr students and all PG, Ph.D students to attend a Motivational Talk by the former Vice Chancellor, SVPUA&T, Meerut (UP) at CAU Auditorium without fail.Govt giving thrust on vaccination to fight new covid waveInstead of adopting a containment strategy, the central and state governments gave more thrust on vaccination to fight against the new wave of Covid-19 variant. As part of the Central Government’s 75-day COVID Vaccination Amrit Mahotsava, Manipur Chief Minister Biren Singh on Friday launched Free-Covid Vaccination of Precaution Dose at a simple function held at CM’s Secretariat.The free-vaccination program for 18 years and above citizens with a target population of 10,18,619 in the state is held under Jan Abhiyan program, as a part of Azadi Ka Amrit Mahotsav celebrations commemorating 75 years of India’s Independence, said an official.Ministers Dr Sapam Ranjan Singh and L Sushindro Meitei, and concerned officials of Health Services, Manipur also attended the launching of vaccination drive that will culminate on 30 September 2022.However, people are curious about the efficacy of vaccination as coronavirus is picking up steam again in the districts which report high vaccination rates. They wanted the Manipur government’s covid 19 common control room to reveal the number of vaccinated people who got infected in the new covid wave.89 new cases reported, two journalists infectedIn the last 24 hours on Friday, 89 persons (44 male, 45 female) were confirmed as new COVID 19 positive cases in Manipur taking the active caseload to 385, said an official source. However, there is no report of death due to covid, it added.According to Manipur government’s covid 19 common control room, Imphal West reported the highest number of positive cases with 39 infected with coronavirus followed by Imphal East (28), Kakching (7), Thoubal (5), Jiribam (2), Ukhrul (2) and one each from Bishnupur. Senapati, Tengnoupal, Kangpokpi, Churachandpur and Chandel.Covid 19 common control room maintained that all necessary medical precautionary measures like containment and contact tracing are in place.More Stories like thisManipur HC withdraws contentious portion in its March 2023…Feb 22, 2024Five Manipuri kids rescued from Nashik schoolFeb 10, 2024Two accused in SDPO Moreh assassination case sent to 15 day…Feb 10, 2024Meanwhile, two journalists working with Sanaleibak newspaper were reported covid positive , said a source on Friday. Both the infected journalists had already got booster doses, it added.Covid 19 trendDate No. of positive Positivity Rate (TPR)1 July 4 5.7%2 July 7 10.9%3 July 16 12.7%4 July 9 5.9%5 July 17 7.5%6 July 22 8.1%7 July 22 7.5%8 July 22 9.9%9 July 23 7.5%10July 27 7.6%11July 45 15.5%12July 59 15.6%13 July 70 15.8%14 July 77 13.6%15 July 89 14.8%"
nagaland-witnesses-steady-surge-in-covid-19-cases-records-159-new-cases,"The commercial hub of Nagaland, Dimapur, continues to top in the infection tally as another 145 new positive cases were recorded on Friday, followed by Kohima with 11 cases, two from Tuensang, and one from Phek.By Imna Longchar, TFM Nagaland CorrespondentAfter witnessing a drop in Covid-19 cases for the past months, Nagaland is now witnessing a steady surge in COVID-19 cases with the state on Friday recording 159 new cases.This is the second highest single day spike for the week after a massive 199 cases were reported on January 12.The commercial hub of Nagaland, Dimapur, continues to top in the infection tally as another 145 new positive cases were recorded on Friday, followed by Kohima with 11 cases, two from Tuensang, and one from Phek.More Stories like thisBhimbar Deuri, a true nationalist of AssamDec 4, 2023Nagaland’s Higher education in progressive transitionNov 13, 2023Naga Students rally for permanent peace in ManipurNov 13, 2023On the other hand, 23 infected persons from Dimapur have registered its recoveries and 1 from Kohima. While the number of fatalities due to COVID-19 remained at 687 for the last 8 days.There are 32,775 confirmed COVID-19 cases in the state and 30,480 recovered cases.Meanwhile, in the State capital Kohima, the Kohima District Task Force (KDTF) on COVID-19 comprising district administration, Kohima Municipal Council (KMC) and Police personnel conducted an enforcement drive on Covid-19 protocols within Kohima town on Friday.According to an official bulletin, the drive led by Magistrate in charge, was carried out in different locations of the town by four teams.During the drive, a total number of 173 Challan were issued to the defaulters and were imposed a fine of Rs 200.In order to create awareness on the importance of wearing face mask in public places, work places and during transport, the team also distributed face mask to the individual found without the mask."
the-unlawful-activities-prevention-amendment-act-2019,"If this document is of any use to you, please do drop in a line addressed to The Frontier Manipur at the following email id:[email protected]More Stories like thisMANIPUR VIOLENCE: A PREMEDITATED AGENDAJun 8, 2023Forest (Conservation) Amendment Bill, 2023May 3, 2023Exploring Universal Basic Income A Guide to Navigating…Sep 23, 2022There are a number of documents with us and we will be happy to share them with you."
get-it-straight-electoral-politics-and-the-culture-of-violence-in-manipur,"The recent killing of a student in Heirok and all the incidents referred to as pre-poll violence in Manipur have to be understood in the light of prolonged militarization and subsequent inheritance of the culture of violence.By Dhiren A Sadokpam“When we allow violence against some, we enable violence against all.” When Native American writer and progressive activist DaShanne Stokes thought of these lines, he meant much more than what he even thought. And we all know violence begets violence and it is even worse when the very roots of violence are wrongly packaged according to popular conceptions bereft of critical gaze.The shooting and killing of a student, Nigthoujam Rohit of Heirok part-2, Mayai leikai on Tuesday night reportedly by masked men comes after a brief lull in the so called pre-poll related violence in Manipur. These senseless violent incidents should be condemned by one and all. Having said this, there is a need to scrutinize the incidents of violence that keep recurring before the advent and after the assembly elections in a state like Manipur.As reported by TFM, Ningthoujam Premchandra, a 53-year old and father of three sons had retired for the night after having dinner at his home located in Heirok part-2, Mayai leikai on Tuesday (December 21, 2021). At around midnight, the locality was rudely awoken with reverberating sounds of gunshots.Rohit, son of Premchandra heard noises at the back of the house and had opened the door to find out what was happening. The masked men standing nearby, wielding firearms shot him at point blank range with a shotgun. Premchandra rushed towards his son’s side and he too was shot down by the assailants. Rohit died on the way to Raj Medicity Imphal and his father is reported to be still in a critical condition.During the month of October, we had also seen a few incidents of sporadic violence supposedly linked with the forthcoming Manipur Assembly election. The one month following October did not see any major incident that could be termed as dangerous by political observers except the most recent Heirok incident.However, during the first phase of the violence when election moods started swaying the public minds, many political pundits, journalists and even newspapers cherry-picked the phrase “pre-poll violence” to characterize the incidents as they occurred at the dawn of an election season. What was even more interesting to note was that these so called violence took place between the supporters of rival intending candidates for an Assembly election that the Indian Election Commission was yet to schedule.Several academics, public intellectuals, and political party spokespersons expressed their opinions on the issue through the medium of mushrooming online and cable TV Networks in Manipur. Almost all correctly identified violence in any form as a threat to the democratic fabric of the society.However, a larger issue that needs to be addressed with critical lenses is whether or not the pre-poll violence, as we have labelled it, is truly tied to ideological disagreements or conflict between political parties vying to snatch power in the name of electoral democracy. It is, therefore, necessary to examine the issue from multiple perspectives.More Stories like thisRole of ECI in Manipur’s Electoral Process: A Systemic…Sep 26, 2023A Call for Hard Negotiations to Eliminate Illegal Poppy,…Sep 26, 2023Manipur Chief Minister Calls for an End to India-Myanmar…Sep 25, 2023Is the violence between groups and individuals we have witnessed in the state in recent months rooted in the ideological differences between the political parties or party allegiance they have supported? The answer is a clear no. Few people are willing to die for any specific political ideology, whether leftist, rightist, or centrist in the true sense of the words. When the season of electioneering begins, senseless violence occurs as a form to terrorize peoplenotnecessarily in the name of political parties but definitely for the candidates whose political affiliations are known by how close one is to the powers that be. Or perhaps, to settle score with the enemies that was pending for long.Hence, it is imperative to look for the source of the violence elsewhere. We have obfuscated the root cause of the violence by pigeonholing it as electoral violence as if the battle turf was made for settling ideological differences. Most of us view the issue through the lenses of election season and tensions that arise between supporters of rival parties.There are also people who argue that ideological conflicts between opposing parties sparked these violent pre-poll incidents. Here, we must not lose sight of the fact that in a state like Manipur, someone who was a member of an ideologically left-wing party yesterday could become a conservative and right-wing party member today. Political party allegiance and Electoral politics in Manipur have over the years rendered party ideologies totally irrelevant.Therein lies the importance of looking beyond electoral perspectives and focusing on historical, political, cultural, and psychological factors. The history of political violence as we understand in modern Manipur may be traced back to the post-1949 period, when the seeds of violent political confrontation between the state and non-state actors, known as ‘Naharol gi Ehou,’ were sown. As such, our people have lived for a long time in a violent atmosphere where non-state actors have attempted to draw the attention of any regimes. While the state’s response had been the attempt to protect the bigger political structure, everything that happens in the state, from domestic violence to mob violence, must be examined in the context of Manipur’s violent political landscape and resultant fear since the 1940s.Assuming the recent violence “near or within” in our social context as mere electoral violence is hugely mechanical in nature. So to avoid unwanted and irreparable impact on the democratic fabric of society, there is a need to find out the cause of the violence by dissecting them from multiple possibilities.If we go back over the last one hundred years, we can see that a new culture of violence had been ingrained in the society. When one dissects the anatomy of violence in Manipur in a wider sense, we can find two types. The first one is violence caused by the conflict between state and the non-state actors. The violence perpetrated by non-state actors or those who do not want Manipur to be a part of India has been referred to as illegitimate violence whereas violence sanctioned and perpetrated by the state to protect its larger political structure is referred to as legitimate violence. Yet, the crucial point here is that either way, whether it is state induced violence or violence committed by non-state actors, both types impose “internalized violent mindsets” in the people.However, the election-triggered violence that we are discussing right now in Manipur has more to do with money and muscle power, as well as the notion of “challenge” pushed forth by dominance-subservience mindset imbedded in our tradition over the last few centuries as a result of historical circumstances. Here, one can note that practically all the violent incidents discussed here have eventually and legally take “individualized forms”. The only reason we call it electoral or poll violence is because of the temporal factor in sequence. Even a disagreement between two brothers or two families or feud between clans can be read as political violence during election season. This despite the fact that a long standing dispute had nothing to do with the electoral exercise. In this sense, most of the violence we have seen is symptomatic of a culture of violence beyond the confines of Assembly elections. And we too have inherited a distorted form of electoral politics.The culture being referred to here does not mean the pristine idea of culture or tradition. Rather, it refers to the acquired violent psychological state of a community whose members are lodged in a geopolitical landscape perforated by militarization and protracted armed political unrest. This underlying culture of violence may be dormant, but it manifests itself in various forms, whether individualized or institutionalized depending on spatial and temporal contingencies.In claiming that we are inherently violent in character, it does not imply that every member of the society is a raging beast ready to attack one and all. Mob violence in our society for instance is a good example of how inherently violent we people are due to a variety of historical factors. No one seem to think that mobs are logic-less, cultureless, or tradition-less as they are constituent parts of a society. Objective material conditions and prolonged state of militarization have eventually determined their characters. The collective frustration and repressed anger must be taken into account when studying actions expressed in a violent form. Thus, the culture of violence is deeply embedded in our society propelled by extraordinary militarization. The consequences can be fatal in the long run.(Dhiren A. Sadokpam is the Editor-in-Chief, The Frontier Manipur)"
