Title,Content
eliminating-light-pollution-essential-for-ecological-integrity-and-human-health-iucn,"The IUCN report cites the example of the Hortobagy National Park, the second largest alkaline grassland in Europe, which covers 82,000 ha on the flood plain of the Tisza River. The Park managers established lighting regulations based on the RASC/IDA Guidelines for Outdoor Lighting, ensuring an environment free of light pollution, which is highly essential for the wildlife thriving in the Park.By Salam Rajesh“Light pollution is the human-caused alteration of outdoor light levels from those occurring naturally. It threatens ecological and commemorative integrity, interferes with amateur and research astronomy, degrades the appreciation of mythologies and cultural practices related to the night sky, mars wilderness experience and landscape beauty, carries risks to human health and wastes energy”.The statement comes as a process of an emerging campaign by international bodies for the elimination of light pollution across the globe, as is outlined in the IUCN publication “The World at Night: Preserving natural darkness for heritage conservation and night sky appreciation” (2004).Light pollution is a relatively new area of deliberation in an obscure region like North East India where there is less of discussion on the proceedings of the subsidiary bodies of the United Nations, far more pronounced in Manipur particularly where the State is yet to deal appropriately with issues on air and water pollution.The IUCN World Conservation Congress 2020, at its session in Marseille, France, had specifically called upon its member organizations and the specialized Commissions to work towards reducing light pollution globally.The world body while urging all concerned to ‘ensure the protection of the nocturnal environment’, appealed to all of its member organizations and agencies for the ‘management of land and water areas to develop, disseminate and implement engagement, education and outreach programs to explain the harmful impacts of light pollution, the benefits of preserving natural darkness, and the methods to reduce light pollution’.With the Ministry of Foreign Affairs and International Development of France in the lead, the IUCN plunged into action to reduce light pollution reminding member organizations that ‘the impacts of artificial light at night affect many biological groups, both flora and fauna, vertebrate and non-vertebrate, and affect the functioning of ecosystems and the free services that they provide to human societies, including pollination’.More Stories like thisInvasive Alien Species In Larger Climate Change DiscourseFeb 14, 2024Outlining Ambitious National Target For Ecosystem…Feb 7, 2024Alas! Woe to Manipur: Nine months into endless killings with…Feb 4, 2024The IUCN report emphasizes that ‘birds are seriously affected by light pollution. They may suffer navigation problems from night lights during migration and become disoriented, tending to fly toward bright lights. The death toll from collisions with lights or brightly lit windows and buildings has generated public concern over the accumulation of dead birds at the base of brightly lit towers. Their feeding habits, particularly of those that eat flying insects, can suffer from the effects of light pollution on their own behaviour as well as that of the insects upon which they feed’.The report further stresses that ‘insects, too, suffer disorientation and death from attraction to artificial lights. Their numbers also decrease as they congregate under bright lights and become easy prey for insect-eating birds. Insects suffer losses due to the interruption of their normal breeding habits by light pollution.On this very note, the report points out that ‘the impacts of light wavelengths on biological groups are very diverse (e.g. orientation, growth, phototaxis, circadian clock, activity modification) and that a biological group can be affected by several types of impact’.The IUCN report is also specific on the fact that ‘artificial lighting disrupts the orientation of many animal species with severe adverse effects (marine turtles, migrating birds, etc.) and reduces the quality of habitats and connectivity within landscapes, with consequences for the viability of populations.The IUCN report cites the example of the Hortobagy National Park, the second largest alkaline grassland in Europe, which covers 82,000 ha on the flood plain of the Tisza River. The Park managers established lighting regulations based on the RASC/IDA Guidelines for Outdoor Lighting, ensuring an environment free of light pollution, which is highly essential for the wildlife thriving in the Park. Hortobagy supports 159 nesting species and 178 regular or irregular visiting species. Every year around 100,000 to 300,000 grey geese (Anser spp.), 100,000 cranes (Grus grus), and 50,000 to 200,000 shorebirds stop at Hortobagy.Citing a case study in Manipur’s Loktak Ramsar site which is an important feeding ground for thousands of transboundary migratory water birds flying in along two international flyways – the Central Asian Flyway and the East Asian-Australasian Flyway – the fishing community of Champu Khangpok Floating Island Village, a unique floating island village within Loktak Lake, raised a campaign to halt the illegal practice of night time fishing using brightly lit LED lights. The campaign had two-prong appeal: first, stop overexploitation of the fish resource, and secondly, stop disrupting the migratory water birds in their feeding season.Taking advantage of the covid-19 restrictions, which nonetheless impacted the livelihoods of the locals drastically during the lockdown period of 2020 and 2021, there was profusion in night time fishing with LED lights, literally turning Loktak into a ‘city of lights’. The Champu Khangpok villagers’ relentless campaign significantly checked the undesired practice, with now only a few erring fishers here and there on the sly.Taking a leaf out of the Hortobagy experience, the Loktak Lake managers requires to strategize a policy for ensuring strict compliance to regulations and halt any form of activity that contributes to light pollution, especially within the Loktak Ramsar site during the migration period of the long-distance flying water birds, many arriving from European destinations, from Siberia and the Far East.It may be recalled that until the year 2012, light pollution as a subject of concern did not feature in any of the IUCN conventions. During the Members’ Assembly held as a process of the IUCN World Conservation Congress 2012 in Jeju, Republic of Korea, a motion to adopt a recommendation “Dark skies and nature conservation” was introduced by the InterEnvironment Institute, a US-based IUCN Member.The motion moved by the international organization was based on the work of the IUCN Dark Skies Advisory Group, part of the Urban Conservation Strategies Specialist Group of the IUCN World Commission on Protected Areas (WCPA). Similarly, the Members’ Assembly as part of the IUCN World Conservation Congress 2020 in Marseille, France, adopted a strong resolution “Taking action to reduce light pollution”. This since, has paved the path for a larger discussion on light pollution as detrimental to ecological integrity, wildlife, and human health in general."
bomb-blast-in-thoubal-district-kills-ar-jawan,"NEWS UPDATE: Bomb blast in Thoubal district kills AR jawan; The IED had been allegedly planted by the proscribed PREPAK (Pro), according to reliable sources.A powerful IED blast at Usoipokpi Sangomsang area under Lilong police station in Thoubal district reportedly killed one personnel of the 16 Assam Rifles’ E-Coy and injured another at around 1:30 pm on Wednesday.More Stories like thisManipur HC withdraws contentious portion in its March 2023…Feb 22, 2024Five Manipuri kids rescued from Nashik schoolFeb 10, 2024Two accused in SDPO Moreh assassination case sent to 15 day…Feb 10, 2024According to police and reliable sources, the IED was planted near a Water Supply tank. The deceased have been identified as L Wangsu (30) Rifleman no 5012874 hailing from Arunachal Pradesh and the injured Pingku Das (28) from Tripura. Immediately after the blast, Thoubal SP Jogeshchandra Haobijam and Lilong AC MLA Y Antas rushed to the spot. The IED had been allegedly planted by the proscribed PREPAK (Pro), according to sources.After the blast the deceased and the injured were rushed to Lilong’s Noor Hospital. Further details are awaited."
dimapur-district-gbs-association-clarify-on-appointment-of-abdul-kayum-talukdar-as-gb-new-market-dimapur,"On the question of Talukdar’s appointment as GB of the New Market, Dimapur, DDGBA said that even if he owned many properties in Dimapur and is a resident of Khatkutti, Assam, no action could be taken up against him as he was appointed by the Nagaland government.By Imna Longchar, TFM Nagaland CorrespondentMore Stories like thisBhimbar Deuri, a true nationalist of AssamDec 4, 2023Nagaland’s Higher education in progressive transitionNov 13, 2023Naga Students rally for permanent peace in ManipurNov 13, 2023Reacting to a comment made by president of Rising People’s Party (RPP) Joel Naga, with regard to the appointment of non indigenous Naga Abdul Kayum Talukdar as the Gaon Bura (GB) of New Market, Dimapur, the Dimapur District GBs’ Association (DDGBA) on Sunday stated that the “show cause notice” served to Joel was aimed at seeking a clarification.The GB association pointed out that Joel Naga being a political leader should have at least taken into account the sentiments of the people while sharing his personal opinion. DDGBA also expressed dismay over Joel’s personal opinion made public at a press conference held on October 7 in Dimapur.Informing that a five-member fact finding team has already been formed, the association said the person in question, Abdul Kayum Talukdar, has been suspended for three months as there is an issue. The findings of DDGBA shall be submitted to DC Dimapur since appointment or termination is not in their domain.On the question of Talukdar’s appointment as GB of the New Market, Dimapur, DDGBA said that even if he owned many properties in Dimapur and is a resident of Khatkutti, Assam, no action could be taken up against him as he was appointed by the Nagaland government.With regard to an allegation put by the NSCN (I-M) on the issue of Talukdar owning land measuring about 100 bighas in Dimapur, DDGBA said the association was not informed about it or the same question was not addressed to the office of the association either from the NSCN (I-M) or the district administration or any other individual."
biased-media-coverage-deepens-manipur-crisis,"I would also like to hold the Manipur State Government responsible for such skewed narratives running rampant in the early days of the conflict.By Urus NingthemchaFirst and foremost I would like to make it clear that I’m writing this open letter to all the media houses in the country as a commoner of Manipur. Also request you to not colour me up as someone with a lopsided view, biased towards certain section of Manipuri society. I’ve been witnessing most of the media houses in India pushing a one sided narrative which is a bit lenient towards the Kuki community since the last three months. I, being a Meetei would have loved to have an unbiased covering of the undesirable political conflict taking place in Manipur. Yes, it looks really good when the narrative that “a minority community is being hegemonized by the dominant majority community” is run across the media platforms of the country. It makes it easier to sensationalize the event to grab more eyeballs for TRP or readership. But as a Manipuri it really saddens me when this kind of uneven narrative is being pushed which defeats the very purpose of the existence of news media outlets in India. Also it damages the image of one community more than the other without actually bringing out the truth and hence finding it difficult to bring forth a solution to the crisis.More Stories like thisOutlining Ambitious National Target For Ecosystem…Feb 7, 2024Alas! Woe to Manipur: Nine months into endless killings with…Feb 4, 2024Wails Of The Antlers, Silence Of The SaviourFeb 4, 2024And partly I would also like to hold the Manipur State Government responsible for such skewed narratives running rampant in the early days of the conflict. From 4thMay, 2023 onwards the internet was shut down in Manipur, later on it came to limelight that internet was not entirely banned in Churachandpur district throughout the first one and half month since the conflict broke out. Here, I would like to question the state machinery why such failure in executing the ban and also why the ban on internet in 21stcentury. These days the right to internet is akin to the right to basic human rights. Why in India this is the “go-to strategy” whenever some unrests take place? Doesn’t it show the lack of capability of containing a crisis without taking away the basic right to information, especially so in today’s time on the state’s part? This led to the Kukis having a massive advantage in propagating their false narrative left, right and centre. As a result the Meeteis were demonized in the initial days, thanks to some conscientious independent journalist and some renowned Meetei intellectuals the air was cleared a bit.Even now it is a humongous task for Meeteis to debunk so many false narratives as the Kukis even tried to rewrite history in their favour many a time. The mainstream media are not even giving the political crisis in Manipur enough weightage, forget the media even the PM has kept mum throughout. He broke his silence only when a ghastly video went viral, at that time also he didn’t talk about ending the violence but maligned the Meeteis in front of the whole world. So, why this selective response? The next time he spoke was when the “no confidence motion” was raised by the opposition, at that time also he kept on blabbering about inconsequential matters till the time the opposition walked out. Only then he spoke on Manipur and ended with nothing to bet on. Here, I would like to point out that many horrible incidents took place on both the sides and if the media really want to bring out the truth then cover all and let the whole world know how terrifying and inhumane the crisis really is. And the best way to stop all these is to pressure the parliamentarians to take up some solid measures to end it all without further escalation.My humble request to all the responsible media channels is to stop being so biased and try to comprehend the ground reality first before reporting anything. To do this you need to synthesize all the information coming from different sources after carefully filtering out the nonsense of any kind. You all also need not be so impatient for the scoops and jump the gun without realising the cultural, historical and political sensibilities of Manipur. I hope you have quite a clear idea on the impact that your coverage and reports are making worldwide and act accordingly. I simply want this cacophony to be over and have rationality back with all of us to be able to bring a solution to this crisis and have the old lovely and peaceful Manipur back."
manipur-unrest-give-thought-to-your-choice-during-elections,"As a youth, we must understand the complexity of the issue happening in our beautiful State. We must dive deep into the core issue. We must not blindly follow what our elders are doing till now… To conserve our future, we must campaign for NOTA, until we find the right person.By Loya-Ngamba SapamIn the aftermath of the battle of Gettysburg, the American Civil War’s deadliest battle, Abraham Lincoln made an address contouring the ideal and mechanism of democracy. In his speech dedicated to the martyrs of soldiers, he famously pronounced democracy is a government “of the people, by the people and for the people”. His speech evoked the essence of the people in the democratic form of government. It clearly laid down the inevitable fabric that connects the government and its citizens. This fabric is not a mere superficial but rather, a deeply intertwined between the electors and their elected representatives in the nation’s assembly or parliament.Loosening the fabricThe intertwined fabric, which is the basis for having a successful democracy, gets saggy or loosened up between the electors of Manipur and their elected representatives in both Houses of Parliament. The state has been reeling under the deadliest ethnic conflict in its history between the Meitei, a prominent valley-dweller, and the Kuki, one of the hill-dwellers. However, their elected representatives, who should convey people’s plight, remained mute not only in one session but in two consecutive sessions of the Parliament, both monsoon and winter sessions. It transpired when the people in the State protested, demanding to speak up and raise the issue of deleterious crisis to the Parliament. In some interviews, one elected representative claimed that he was being gagged by some externalities. So, he had to drop the people’s will to raise the matter to the Parliament. This not only disconnects limited to the state’s elected members of parliament (MPs) but also manifests among the other MPs as well.More Stories like this2024 Census shows Loktak Waterbird Count lowest in DecadeFeb 24, 2024Manipur HC withdraws contentious portion in its March 2023…Feb 22, 2024Invasive Alien Species In Larger Climate Change DiscourseFeb 14, 2024The session adjourned several times in both Houses of Parliament, particularly the monsoon session, literally without any fruitful debate over the crisis in Manipur, even though the session was held at a time when there was a huge crisis in the state. The people were butchered, their bodies mutilated, women paraded naked and fueling hatred by the social media platforms. The lack of concerted efforts to have a debate in the Parliament reflects the tardy approach of elected MPs to contain the wildfire, particularly the MPs in the ruling party. This apathy makes the people in the State feel the wicked stepmother attitude of the parliament. This will prolong the wound of persistent unfair treatment and discrimination faced by the people of the North Eastern States of India, especially by the people of Manipur. In the long run, the unfair treatment of the Parliament will create resentment or bitterness among the people, particularly the youth affected by the crisis. It has seeded the plant of bitterness, which will further the regionalism and may pose a threat to the social and political integration of the nation. The already broken link between the electors and their elected MPs became widened due to ineffective and inefficient handling of crises by the governments at the Centre and State.In fact, the inefficiency of BJP-led governments at the Centre and State has been credited for stretching the ethnic conflict. So far, the state government led by Biren Singh has not rolled out a specific policy approach to contain the crisis. Many lives would have been saved if the government deployed effective measures and strategies. The wound is deep but, the government is giving only the first aid. A crisis of such magnitude needs not only lip service but also concrete and well-laid-out plans. The policy must focus not only on short-term but also long-term strategies.The NOTA campaignWhen the people of the State were being beheaded, butchered, murdered, mutilated or women were raped and paraded naked, dishonoured their dignity, school kids were captured, tortured and even not able to find their dead bodies, the MPs in both Houses, both in government or Opposition, turned their blind eyes and didn’t turn up when people are asking for their help to resolve the crisis. Why should we still vote for merciless people? Why should we exercise our right guaranteed under Article 326 of the Indian Constitution to elect such a person who turned a blind eye during our needs? Moreover, reports have shown that 43% of MPs in the 2019 Lok Sabha elections were linked to criminal cases, why should we give power to people who committed crimes? We need to rethink our electoral choices. Isn’t it worth exercising our choice to NOTA rather than to merciless criminals? To conserve our future, we must campaign for NOTA, until we find the right person.As a youth, we must understand the complexity of the issue happening in our beautiful State. We must dive deep into the core issue. We must not blindly follow what our elders are doing till now. The complexity will grow further if we don’t give thought to our choice of vote. It is time to question whether the candidate filing for MPs or state assembly is right or wrong, whether the candidate is coming to serve the people or harm the people, or whether she/he is coming to have personal gain or not and many more. We should ask as many questions as possible to make a correct decision. If we don’t find the right feat for our candidate, why don’t we go for NOTA? It is better to live in an ordered state, rather than to live in a state governed by merciless criminals. In addition to putting an end to community animosity, the collective “right decision” will inspire a new generation of leaders who will be able to carry out the wishes of the people.(Loya-Ngamba Sapam is an alumnus of IIT Delhi and can be contacted at[email protected])"
